comment,date
i just checked the digital copy and it’s still there the exchange “all the fun of being an uncle and none of the responsibility” with madame web responding “that’s what he think”,2024-03-20
i cant even tell it youre making this up or not,2024-02-15
i’m speechless i was genuinely trying to think of something funny to say but nothings coming to me,2024-02-15
are we sure this isnt like that time someone edited the wiki for passengers and made it about pigeons like this isnt real there are so many ways to to this and this isnt real,2024-02-15
so did peter just independently come up with the costume and it happened to look like the tribes,2024-02-15
 there’s no  way i wasn’t going to see it because i heard it’s not so bad it’s good it’s just lazy and bad but now i feel like i have to out of morbid curiosity,2024-02-16
you cant convince me that trey parker  matt stone werent ghostwriters of this just to  around,2024-02-15
what happened to her mom in the amazon did she end up dying,2024-02-15
the funniest thing about it is that they chose the whitest latin american who does not look remotely native american to play the ancient spider tribe leader lol,2024-02-19
,2024-02-15
what the ,2024-02-15
wait theyre not doing that spider  thing from the comics are they like where the different spider people are different aspects of the same spider  ive seen some very negative opinions on that storyline so im honestly quite surprised that they would even adapt that,2024-02-16
can you clarify something that doesn’t sound like the movie was suggesting that peter was committing cultural appropriation that’s your conclusion based on the existence of these characters correct,2024-02-16
the funniest part about this is that when dakota johnson later goes back to the amazon and the leader of the tribe is just dressed like a typical person,2024-02-19
"the thing is this storyline is from the comics and was a kore change people hated when it was done back in 2004

i dont remember if there was a spider tribe but there was a spider 

i actually thought the comic story line was ok in the end but its been years since i read it",2024-02-23
"i do laugh that apparently everyone who has ever got tangential spiderpowers over apparently hundreds of years at this point all independently come up with the exact same design for their supersuits  

  las arañcas all have various red paintvine spiderman design suits even with the unnecessary eye holes  
  ezekial despite never actually meeting las arañcas designs an almost 11 modernised grey version  
  madame web and her webbing trio all have varying plays on the spiderman suitinsignia despite mw being the only one to see las arañcas and being blind at this point and nobody ever having met peter parker as he doesnt exist for quite a while yet the only person they would have met with a similar suit is ezekiel who i doubt theyd want to imitate in any wayshapeform seeing as hes literally the guy that tried to  them as children  
  peter parker then 1520 years later despite never knowing about the web sisters nor ezekiel nor las arañcas comes up with pretty much the exact same design  

i get why multiverse peter parkers all end up at near enough the same suit because theyre the same person under varying circumstances but it repeatedly happening independently within the same storyline is kind of hilarious",2024-04-01
huhhh i kinda need to see this movie now that sounds unbelievably ,2024-02-15
i feel like i need to watch the movie now cause this sounds so ridiculous hahaha,2024-03-12
thats from the comics though the spider totem stuff thats where ezekiel comes from,2024-02-15
the feeling i get when reading this comment is the feeling i get when im trying to figure out if a video is real or sora generated,2024-02-16
i have to see it now  i have to,2024-02-21
they look like if you covered deadpool from origins wolverine in black webs,2024-02-23
comic jjj is actually woke on every other issue but spiderman,2024-02-17
" i had such high hopes for hellboy 2019 another case of a movie having absolutely hype trailers and not being able to live up anywhere close to them

maybe the other hellboy reboot thats due out later this year will do better",2024-02-15
also it gave us one of the best x men movie videogames with a plot that was better than half the xmen films,2024-02-17
ah right i forgot which came first between endgame and iw but i dont think removing dark phoenix from that list really changes anything about the actual point,2024-02-15
i mean personally id say dark phoenix is the worse movie but to each their own either way theres still no shortage of bad superhero movies,2024-02-16
"spiderverse came out in 2023 as well as tmnt if you want to count it obviously theyre animated but theyre still comic book movies for 2024 weve got deadpool and joker 2 which id say have decent shots at being good

but to your point yes  its been an off couple of years but its also worth noting the few years preceding iwendgame were major outliers

i mean look at 2009 its pretty much all duds watchmen is probably the best and 2010 wasnt much better even if you jump forward to 2015 the only standout is antman which is hardly toptier and its next to the disappointing aou and the absolute  fant4stic 

the hit ratio really isnt much different now than it has been for decades we just got spoiled for a solid run of 3 or 4 years and even then we had movies like suicide squad and justice league",2024-02-20
he was in torque and they did that movie so i’m sure it’s ‘wait a respectable amount of time and don’t have adam scott as the guest’,2024-02-15
funny enough i’m listening to that episode right now,2024-02-15
98 of venom is tom hardy,2024-02-16
im not op but if i was gambling man id say theyre probably both studying spiders in the amazon,2024-02-17
i may have misworded i did really like it and enjoy it not quite what i had expected but nevertheless it kept my attention the whole time so i don’t consider it to be bad hopefully going to see it again in a few days,2024-02-21
i mean i assume she would go to lima and take another flight to a smaller locale,2024-02-17
"the gag reel that was added in the last week or two for the anyone but you valentines edtion or whatever they are calling it 

it was not there before nor was the short video before the movie of syd and glen saying hi and thanking the viewers for supporting their movie",2024-02-16
i saw a clip of that scene reposted on twitter and she honestly killed it there there were a couple bits that stood out that she just delivered every terrible line perfectly i think they mustve been filmed early on when she was still trying,2024-02-18
no hints no structure just straight random guesses,2024-02-21
very true good point,2024-02-15
in the spiderverse films someone tragic backstory is shown in a short scene i suppose they didnt have the budget to do that here,2024-02-15
"were the millers

yeah that was before nerve though so i didnt mention it",2024-02-15
what happened to her,2024-02-16
but i envision the scene was similar across the nation lost souls coming for the cheap thrill,2024-02-16
ben is an emt and his partner on the ambulance is madam web which is the only reason hes in the movie i genuinely do not have a clue why mary is in the movie at all let alone why shes pregnant,2024-02-15
it’s rumored that was the original plot then sony scrapped it because originally they decided it was a prequel to garfield’s spiderman before changing it to holland’s then realized the timing was off so they scrapped it,2024-02-15
that subplot was cut but the characters were not so they are more there for the sake of being there more than a few were cut,2024-02-15
" i thought the whole point of the movie is that the villain is trying to  mary parker so she doesn’t give birth to peter

that was allegedly the original plot which was changed when it was realised setting it up in 2003 wouldnt link it to any of the other spiderman films sony made

the even funnier thing is that changing the targets to the future spiderwomen could have made sense in a way that engages with spiderman lore and couldve easily set up a legitimate franchise option for sony

the main villain is ezekiel sims who in the comics almost exclusively exists to introduce the concept of spider totems multiversal spiderpowered individuals to the audience

have his premonitions be about seeing the inheritors invading earth due to the increased number of spider totems between ezekiel and the 3 spiderwoman that allows a legitimate motive for ezekiel to want to  them in a way thats not just theyll  me in the future 

that way you can introduce the multiversal vampiric hunters and it leads almost directly into a comicaccurate live action adaptation of spiderverse which was the inheritors embarking on their great hunt",2024-02-17
maybe im dumb but i didnt even get that was meant to be mary parker and just kept thinking why is emma roberts playing a random pregnant woman in the film,2024-02-18
why would you think that the parkers are more of an easter egg in this movie,2024-02-25
waitben is a parker if ben is a parker and his sister is mary parkerthen why would peter be peter parker i always thought may was the parker,2024-02-16
"

budget budget budget budget 

of course it would have made more sense to have the 3 girls have their powers but it would have made the move more expensive so you do 2 scenes and pack them in the trailers",2024-02-16
reportedly this was the original plotline but they had to scrap that and do extensive reshoots so the villain is now trying to stop the girls from becoming spiderwomen,2024-02-20
yeah lol,2024-02-24
evil spiderman was trying to  the girls because he had a vision of the future where they all had spider powers and they  him note they do not have spider powers in the movie he just thinks theyre going to get them in the future the girls were staying with ben because madame web had to go to peru for a week to learn about time travel mary was staying with ben because richard was on a business trip in asia,2024-02-15
they should have done terminator this is just nothin,2024-02-15
both are referenced but neither are actually on screen,2024-02-15
its set in 2003,2024-02-15
better go see it twice in the theatre to make up your mind,2024-02-15
theyre downplaying how good it is so in a few months they can rake in the karma by posting how underrated it is,2024-02-15
i dont know why these sony movies look like  even if you cant be bothered to provide a good script at least make sure your movies look visually appealing this is som michael bay understood,2024-02-15
i have no words,2024-02-15
reminds me of how the x3 trailers had sentinels but they only appeared as holograms in one scene where they were training,2024-02-15
oh my  they did the rhino from tasm2… again…,2024-02-15
"this movie just got kangaroo jacked that iconic shot of the girls in the superhero outfits appears in so much promo material

ive been crying laughing reading the reactions in this thread

this movie is perfect riffing material with the boys once it comes to stream or dvd",2024-02-15
they spent time to make the costumes get them fitted for the actresses and used in marketing all for 2 minutes of screentime insanity have they ever seen a movie,2024-02-15
wow a super hero movie where the heroes have no powers or wear costumes how edgy no wonder why this movie sucks balls,2024-02-15
what the ,2024-02-15
cant wait for this writer to get another big budget job,2024-02-15
baaaaahahaha,2024-02-15
that is  unreal what a  idea for a movie it already  when these movies would withhold a classic suit until the very last second of the movie they somehow went further and kept the characters people would actually care about out of the movie altogether insane,2024-02-15
"the final scenes being about 30 seconds long 

its a total bait and switch for future movies",2024-02-15
wait really holy  they straight did false advertising for this ,2024-02-16
like seriously lol,2024-03-20
i still maintain the movie was okay and fun but this just infuriates me so much i got an ad for the trailer again and it was focused on the girls getting powers and did i want to watch the movie because i wanted to watch sydney sweeney with powers of course yes and the movie subverts it by saying haha no,2024-02-17
yeah i said there was no redeeming qualities maybe i was wrong  a martha stewart joke from a movie set in 03 is kind of funny  ,2024-02-16
i laughed at that guy on the subway who kept asking dakota if he was on the right subway,2024-02-25
parts of it are  fun particularly the beginning and the end the middle is mostly just really boring,2024-02-15
no the beekeeper is  fun  this is just trash,2024-02-15
it wasnt that fun  they could have made it more fun and didnt  i defended mortal engines as a fun time even when people were bashing it  this really had very few fun moments,2024-02-16
her ribs must have been pulverized into dust,2024-02-15
i smell something burning its this dupsterfire movie,2024-02-15
aha a pretty little girl,2024-02-15
she went blind cause a firecracker kinda brushed past her eyes but ive no clue why shes in a wheelchair apart from trying to make her look like her comic counterpart,2024-02-16
on the former i am convinced the opening scene was originally just in the middle of the film that the first we would have seen of santiago would have been him in regular clothes and then cassie would have seen the opening scene as a flashback in that vision including him in his tribal spidersuit,2024-02-15
2003 tech was wild,2024-02-15
" the protagonist defeats the villain by crawling backwards to ensure the s from a a falling pepsi sign hits him before she is suddenly blinded and paralysed by a firework to the face

what in the wide world of sports

is this madlibs",2024-02-15
oh no what i meant was i did not know if there were actually 40 super hero films in the last 5 years or not,2024-02-15
better question why couldn’t she foresee herself getting hit by the firework,2024-02-16
she has the power to be all over the place,2024-02-15
she’s completely emotionless in absolutely every single thing i’ve seen her in she’s a hack,2024-02-18
makes sense and thanks,2024-02-19
i dont think that many families are scared of sydney sweeney lol,2024-02-19
is it a family movie,2024-02-17
"its hard to give people too much  for sexualising her when the movie sexualises her so much people arent thinking about the characters age so much as the actors

way less weird than the people thirsting after gwen in atsv the table scene is v much a yikes at the writers tho",2024-02-19
the problem w johnson compared to pattinson and reynolds is that i dont think ive ever seen a comment anywhere saying she was exceptional in anything after 50 shades the second that pattinson got announced as batman there were a lot of doubters but there were also people talking about how amazing of an actor he was in all those indie films his charisma is also kinda unmatched both on screen and in interviews its partly why him  on twilight actually worked because he was funny and likeable about it hes never comes off as overdoing it reynolds is in that rdj camp of over overcharismaing about it but it still works most of the time johnson is kinda just unfunny and wooden all around but i guess well see whether or not she was wooden because she lacked the right director since song has proven herself as a director itll be hard to hide her lack of acting when shes put up against pascal and evans,2024-02-15
thats my boy ,2024-02-19
"who the  was her dad did she have no other family not a single other person alive in the us i also noticed that detail but didnt think he was the father 

my theory is that everything in the jungle was a reshoot so that would fit",2024-02-16
that would be a better story ngl,2024-02-15
i hadnt realized this was a 2 hours movie,2024-02-15
yeah if youre as big as coke or pepsi you just advertise for awareness rather than trying to get your product known or something those types of companies will always have enough customers they just advertise to entice someone like you just mentioned to think about getting one when they already like it it is to keep market share up as well because if you were to suddenly see pepsi stop doing ads but coke does everything people would be like whats up with pepsi maybe not a lot of people but enough in their eyes and despite how much random  happens in big companies that makes no sense especially in marketing they probably have done a costbenefit analysis on reducing the amount of ads,2024-02-15
what soda are you going to get,2024-02-15
maybe cocacola paid them to put pepsi in the movie,2024-02-15
"yes green lantern at least felt like its trying to be something and its got the sick sequence on the alien planet plus ryan reynolds at least has charm

this has none of the above",2024-02-15
green lantern was bad but there are a few sequences that are good and ryan reynolds was not too bad,2024-02-15
yeah i don’t understand how people grade super hero movies  everyone seems to understand they’re not supposed to be tarkovsky movies and happily forgives the nonsense plot of endgame but then treats a perfectly serviceable movie like the flash like it was the room,2024-02-15
im sorry what do you mean give up like she just cant open the can,2024-02-16
"yes but they dont hit as hard thats literally the definition of mediocre a few good ones a few bad ones

prime marvel was great",2024-02-17
"i thought loki was pretty bad in season 2 it felt like loki was a completely different character for the version that jumps off straight after the events of the first avengers movie 

moon knight was boring af i couldnt get through it same with wandavision

shang chi was pretty forgettable

gotg 3 and no way home were pretty good though",2024-02-16
"mmm i would have to disagree zlatan and messi are zlatan and messi forever 

and because of the skill gap they still dominated

marvel is not dominating nothing to be ashamed of to be honest most of us only really have 10 good years of anything any bandartistactorathletefighter only really have a prime 10 year run in them

theyve lost relevance as the zeitgeist is switching back from losers saving the world to winners fighting each  other for control

if the comicbook genre survives itll be the new dc leading the front",2024-02-21
an evil spider enterprise,2024-02-18
atst atst,2024-02-16
i mean in that its badness stems from several key conceptual choices early on in production that impact everything about the movie why is a 28 year old playing a 17 year old  why do the super important future spider people not do anything relevant in the plot,2024-02-15
the baby shower scene was high art,2024-02-24
 how did she get from remote peru where she was born to a new york city orphanage,2024-02-17
see that might have been an interesting scene to i dont know put in the movie,2024-02-18
no she was in peru for a week it just happened she returned at the same time mary parker went into labor and the girls subsequently showed their faces in public speaking of which why did they have to go with ben and mary why couldn’t they have stayed home realistically wherever they were how could ben have protected them from bootleg spiderman,2024-02-17
good point i missed the front page of the paper lol i was probably still trying to make sense of the craziness of the subway scenes,2024-02-19
"i think its intentionally a joke once any of the spidermans didnt want to appear


they saw morbius get destroyed and just made changes to make this funnier or didnt bother to change the script hoping that the internet would go see this to see how bad it is",2024-02-16
i hate to be the camp police but being earnest in presentation only to fail and be laughed at is like…one of the most well known presentations of camp,2024-02-23
wait yeah totally forgot that thanks,2024-02-17
"not really its actually impossible to know what you think until you see something you see i went in looking forward to the train wreck and ready to  all over it but was pleasantly surprised 


i didnt pay for it because i thought no way am i paying for that trash and i wouldnt tell anyone else to either but it was good enough for a rental 


most definitely not the worst film ever made kind of insane how many sheep are out there that wont try to form an opinion themselves suppose thats just the terrible world we live in right now",2024-02-22
"follow through doesn’t seem to be cassie’s strength 

i was more annoyed at elly’s treatment of her cat in argylle because it was her pet and the movie made such a big deal about it only to just “whatever” the cat in the third act",2024-02-21
not the worse use of a cranberries song in a recent movie at least,2024-02-15
nah they definitely baby mouthed his face a few times like the superman reshoots in justice league,2024-02-20
can’t be worse than madame webb apparently,2024-02-15
nah itll be timothee chalamet or someone with zach braff as either the villain or rhinos dad,2024-02-20
i would recommend cha cha real smooth i think this was a good role for her i overall enjoyed that movie largely because of her came out in 2022 and streaming on apple ,2024-02-19
"ur both right the album came out nov 15 2003 and toxic the single was released early 2004

but the movie takes place in warm weather not in winter so they messed that up too",2024-02-17
what would you give madam web 110 10 being lowest and 1 being top tier,2024-02-16
he probably was glad she was out of the way he probably thought what’s she going to find in peru meanwhile he just needs to find the girls which he does he just needed five extra minutes,2024-02-17
touch a nerve maybe dont take the internet so seriously itll be good for you,2024-02-16
whatever nonquipworthy thing she said back in the forest when one of the girls tried to test her ability,2024-02-20
the wheelchair and glasses at the end was meant to evoke prof x yes because that’s all i could think ,2024-02-19
"the album came out in november but still after the time in which this movie was set it was the fourth single released in january and didn’t hit radio until then

and the dj  called her an up and coming artist like nobody knew who britney spears was in 2003",2024-02-16
they don’t actually get their powers or costumes in the movie it’s only in a brief 60 second long vision that madame web sees,2024-02-15
expend4bles was a pretty good funnybad movie i had a blast seeing it with my buddies and ive never even seen the first 3,2024-02-15
"thats a different issue a lot of  didnt make sense in this movie but

im guessing since shes an emt she gave a good explanation especially with what happened to her its better than a random person stealing an ambulance

and the kidnapping id guess the girls explained it to the nypd",2024-02-18
lol yes haha k thought i missed some bad easter egg,2024-02-19
aside from airport security not being alerted the most confusing thing to me is how she could get back into the city without switching cars,2024-02-26
same i saw it the saturday after it released it was so bad i went back to see it again immediately with some friends and had a pitcher of beer throughout and it was even funnier the second time i ended the night with going to see it a third time but after halfway through  had had enough and found out a girl id been seeing was at the same theater so i ditched it but the 2 and half times seeing it in the same day was something ive never done for another movie ever,2024-03-18
thats true i just went to my 5th screening of it last week and will probably go again next month we didnt need to bring spoons because the people behind us threw so many that we had plenty land on top of us,2024-02-16
its absolutely worth watching for all the wrong reasons lmk if you did end up going to that matinee or not xd,2024-02-21
she is in a swimsuit for much of it,2024-02-15
i will imagine you would have said barbie then ill look at the box office and then ill laugh,2024-02-16
i’m sorry that she offended the comic book movie community,2024-02-16
"my interpretation was she had the vision of what would have happened if she decided to go to the diner he would have been there and told her that stuff and after the vision she was satisfied with having the fractured information from the vision and decided not to leave the hotel

bad movie but i found it more mediocre bad than entertaining bad",2024-02-18
nope morbius is still worse,2024-02-22
id go as far to say that this is even worse than that leaked precgi version of xmen origins wolverine,2024-02-21
what did he bring because i actually felt nothing from watching him ,2024-02-22
"is that the only movie marvel has ever released

who knows maybe if marvel releases a few more the marvels sony will stop making these bits of faff",2024-02-15
but that’s the thing… this movie tried to be good thsts why they teased the costumes so little they were setting up a trilogy lol,2024-02-18
