comment,date
i like the line from the villain where hes like “they will destroy everything i’ve built” but like  did he build they never explained anything about him is he a businessman an arms dealer does he go out as spiderman at night it’s literally just him and shosh from girls in a room,2024-02-15
"for anyone wondering 

yes the fact that all the shots of the trio in their hero suits are all in the same location at night as well as the weird emphasis on how fun and important it was for sydney sweeny to hang upsidedown correctly means that the only time they are suited up is for maybe two minutes in a psychic vision",2024-02-15
madame web’s superpowers are “get down”,2024-02-15
my favorite was when the villain would talk and his mouth wasn’t even moving it was like watching those old dubbed japanese movies,2024-02-15
didnt realize this movie was written by the dynamic duo from morbius until somone on twitter pointed it out,2024-02-15
her walking thru the woods to the diner was way faster than her driving there,2024-02-15
"i hope this is a wake up call in that for the venom movies that the only reason they were successful is because venom is household name and tom hardy’s star power

honestly someone should check if hardy is okay because i’m almost positive sony have a  trained on him for they know if he leaves venom fails",2024-02-15
i’ve never been so tempted to take out my phone and use my notes app just for the sheer amount of terrible lines  like holy  webb and the villain guy’s adr were in a  contest to see who could read their lines worse,2024-02-15
"only when you accept responsibility will great power come

bruh",2024-02-15
gotta say the scene at the end where they cut to the hospital bed with cassie wearing the eye bandages was one of the funniest  things i’ve ever seen idk why but that was just comical,2024-02-15
pretty  up she just isnt going to tell ben whats going to happen to his brother and sisterinlaw and it was supposed to be cute,2024-02-15
congrats to pepsicola for being the strongest member of the spidersquad yum delicious pepsi,2024-02-15
sony just looked at the front page of the script and said okay,2024-02-15
adam scott whatre you doin bud,2024-02-15
i love the fact that the fireworks factory catches on fire twice like this is some  loony tunes episode,2024-02-15
why is no one talking about this so hear me out the movie is in ny she hears on the car radio that the cops are looking for them mistakingly thinking she kidnapped the 3 young girls she takes em to new jersey and says stay put i’ll be back in 3 hours i have to look into the bad guy at my house girls don’t stay put and go to a diner right so it’s been maximum 4 hours since their kidnapping they are in a different state this movie takes place in 2003 and you got a trucker across the diner reading a news paper with front page news being the 3 girls pictures and their kidnapping being like let me call the cops how the  did that newspaper get out and make front page news across state lines in bum  nowhere new jersey within 4 hours ,2024-02-15
"thats the thing about the future… it hasn’t happened yet 

sony must be stopped",2024-02-15
the “he was in the amazon with my mom when she was researching spiders right before she died” line wasn’t even in the movie…,2024-02-15
congratulations to the people who greenlit the kendall jenner commercial you are now no longer the biggest  in the pepsi marketing department i dont even want to know how much they paid to plaster their logo all over this giant piece of  movie that no one is going to see,2024-02-15
"something like onethird of this is the characters playing a at one point literal game of “how close can we get to saying ‘peter parker’ without actually saying ‘peter parker’” and somehow that’s not the worst part of the whole thing which comes down to a stiff competition between the performances especially a visibly bored dakota johnson and a careerworst tahar rahim the effects which really embody the early 2000s era of the story by looking not like an early 2000s movie but an early 2000s fmv game the script its plotting and characterizations so thin you’d think the shoot was an extended game of improv and sj clarkson’s abysmal direction and the nonstop crash zooms and jump cuts and brazen adr it comprises

edit i just remembered that madame web is blinded when she is hit in the face by a firework that she herself set off this also puts her in a wheelchair for reasons i can’t quite parse jesus christ what a magnificent shambles it gets better the more i think about it i’m genuinely laughing at my desk",2024-02-15
the girls were so funny when they all slept in the same bed it made me want to have them wear one color like huey dewey and louie there personalities basically being “the rebellious one” “the shy one “ and “the smart one” ,2024-02-15
morbius was better like not even joking…,2024-02-15
"of course this movie is really bad and ridiculous but will point some of the stupider ones

movie never explains what links them nor gives any indication howwhy these women would be good superheroes theyre never selfless or show any skill other than cpr

the villain can see the future butthe future changed was it a false vision which leads me to


i dont get dakotas power is she having visions or is she time traveling sometimes she is aware she is in the future and sometimes she is completely shocked in the climax getting to the helicopterwas that not her seeing the future or a possible future like why did the helicopter go down if thats not what she saw",2024-02-15
i guess nobody cares enough to write up the plot on wikipedia can anybody tell me if dakota johnson ends up as an old blind lady in a wheelchair at the end,2024-02-15
zero hope for kraven at this point ,2024-02-15
how did this movie get made i really don’t understand ,2024-02-15
"this was absolutely  awful  worst film ive seen in the cinema in years and yes its worse than morbius

the good

 celeste oconnor and isabela merced were the best parts of the movie

 there are a few nice shots i guess

 the joke where dakota tries to climb the wall like spiderman and falls down its lame but it made me laugh which is more than i can say for the rest of the movie

the bad

 the dialogue just so much boring exposition so many awful jokes that dont land characters talk like human beings never do like introducing themselves by saying their full name for our benefit

 the plot for starters its an insanely generic origin story then there are insanely dumb story points like the villain having a premonition of the spiderwomen beating him in the future so he somehow manages to capture images of his dreams and then uses software to theorise what the spiderwomen look like in the present and they suddenly morph into exact images of sydney sweeney merced etc its insultingly 

 the inane subplot where cassie gets framed for the villain attacking cops wouldnt the subway have cameras even if not it felt so contrived considering the villain is shown having control of the citys cameras a simple line about him interfering with them wouldve made this better

 all the desperate spiderman links i like adam scott but never really bought him as uncle ben and the subplot centered around the birth of spiderman felt tackedon

 the with all power replacement line the first time i didnt think it was so bad but its repeated later on and made me laugh

 technically this film is a mess it makes morbius look competently directed by comparison tons of weird snapzooms and digital zooms for no reason an excess of shaky cam which makes most of the action look awkward or tough to follow

 bad editing feels very choppy also makes the premonitions more annoying than exciting to watch

 most of the cgi sucks

 villain is awful

 for some reason most of tahar rahims dialogue seemed to be dubbed sometimes its legit out of sync onscreen but a lot of what he says is where his mouth isnt visible on screen yet it was noticeably recorded after the fact because the timbrereverb sounds different

 obnoxious product placement for pepsi the baby shower scene for mary parker has a can of pepsi strategically facing the camera in almost every shot also the final battle takes place on the roof of a pepsi factory and the villain gets crushed to death by a pepsi sign 

 lazy obvious musical choices like britney spears  toxic

 performances arent great for the most part johnson just feels awkward and not in a fun selfaware way sweeney felt miscast to me i just found her goofy stockings and glasses setup completely laughable too

 trailers lied about the movie spiderwomen never suit up except for about 45 seconds of flashforwards at the beginning and end of the film

i thought this was absolutely dreadful and not even in a fun way like morbius theres no have  scene its just soulless and dull from start to finish 210",2024-02-15
back in the day i watched a bootleg version of twister on vhs where the guy recording from the back of the theater put himself in the film credits as director of photography that was a better experience than this,2024-02-15
why does ezekiels voice sound soodd like it was added post or something hard to explain,2024-02-15
"this was a disaster from the gaping plot craters to the stilted dialogue to the wooden and sometimes unintentionally funny performances this was a product placement stuffed frankenshow from start to finish nonsensical plot contrivences bad action and a really forced attempt at a family dynamic that did not work also holy  the adr was bad as were the 80 million 360 camera turns michael bay would blush only points for the wall crawling joke that mustered a chuckle and the defibs on the ambulance roof was a neat use of the powers not sure about practicality


ps who watches christmas carol in  july",2024-02-15
i was barely hanging on because of the horrible pacing but then cassie says she needs to go to peru and i got the feeling the movie was actually going to go back to peru and i walked out it was that bad there was just zero redeeming qualities about it i had a feeling that the only time we were going to see them all in costume was in that flashback at the very beginning leaving me nothing to look forward to and reading these comments turns out i was right i wanted this movie to be laughably bad but it was just unfortunately bad i knew i was  when the director chose in the first five minutes to use an umbrella being opened as a jump scare,2024-02-15
im sitting here laughing at the comments and wondering why the  you people would look inside the bag marked dead dove do not eat and expect anything different,2024-02-15
"i lost my  mind at the end when madame web is cracking jokes about mary parker dying and ben having to raise the baby like thats your best friend at work you just let like 20 people die to save 3 teenagers you never met but wont warn your friend his family is in danger

x200b

 just so much of this was insane in the worst possible way absolute  morbius is better",2024-02-15
the opening five minutes being a massive lore reveal that peter parker is a culturally appropriating racist who’s been doing the equivalent of wearing native american headdresses to coachella is  incredible,2024-02-15
do you think there was people that were genuinely excited about this,2024-02-15
i’m really confused on why she was still driving that same cab with no license plates,2024-02-15
well you gotta give them credit they made a movie even worse than we all knew it’d be,2024-02-15
why did y’all go see this ,2024-02-15
"i went to see this movie alone at an amc at 1 pm on valentine’s day surrounded by about four or five other truly twisted individuals beyond saving

so yes i saw the movie in the way i believe the writers intended it to be seen

this movie became a mustsee for me after the infamous trailer drop got memed to death and dakota johnson nixed her agent before embarking on an incredible press tour

that tour featured her apparent puzzlement at the trailer’s online reaction and also a series of various seethrough garments that i firmly believe were engineered in a lab to distract the masses as much as scientifically possible see the butt cheeks and boots outfit on seth meyers

suffice it to say that coming out of this movie i had a lot of questions

did the american heart association pay the studio to promote the practice of cpr

why did the writers feel the teen tragedy trio all needed to have the saddest parental backstories possible

what kind of plastic junk is mattie’s dad helping to manufacture does he work for a temu contractor

why did the teen trio just walk away from a campfire they built in the woods

how much money would the forest service had to have given sony to get some fire safety promotion

why is the diner 50 feet from the woods is this common in new jersey

how did emma roberts’ agent talk her into being in 5 scenes of this movie is emma roberts okay — did she lose money on crypto

why did the writers make us sit through dakota johnson’s deadpan awkwardness at a baby shower

what the  is the villain’s day job what is his daytoday motivation other than not getting killed by the tragedy teens in his near future what does he do besides look after his pet spider nag his evil assistant and create the world’s best surveillance system using a 10digit passcode he got from his nsa honey whats the extent of his relationship with his evil assistant — does she sleep at his place

will madame web ever obtain any real powers or just the ability to envision the future and summon the world’s worst cgi sequences

and finally when is madame web 2 coming out  and will emma roberts be back",2024-02-15
as someone who will never see this movie can someone explain what the mary parker thing is,2024-02-15
"im not sure if i have the time to properly get into all the ways this movie licks  so bear with me here madame web is an utter mess of tone and character that lets you down at every turn a movie hacked to so many pieces that the adr and cuts feel like theyre held in place by scotch tape a two hour runtime with no real humor or action to speak of and four leads that struggle to fit in the most basic backstories and who all have negative chemistry with each other

the whole thing is just so  awkward dakota has zero urgency in her opening scene in which shes racing an ambulance through nyc with a patient in the back and she holds that level of intensity for every action sequence her dialogue seems to be distilled down to saying everything thats happening out loud and there are tons of scenes between the four main gals that have no rhythm and you may struggle to even figure out what their dynamics are when they arent saying super obvious things that wont come into play later like science matters  the premise of the movie is the great importance in these three girls but the movie doesnt depict them as having any sort of special outlook or skill or even morality that could possibly make them useful supers and to make this bowl of nothing that much more disappointing none of them even gain powers or don their outfits surely thats all being saved for madame web 2 no doubt rushing into production as we speak

im not going to go as far to say this movie is subversive because i think that implies some sort of thought put into the decisions and what to depict but its hard to see any other reason that the 40th superhero movie in the last five years would feature no heroes or real fights there are action scenes but its usually seeing a small glimpse of action or a death that would be cool if it werent so toothless then snapping back to reality so dakota can do something to avoid it beyond seeing glimpses into the future unless it would stop her from being paralyzed or permanently blinded her only superpower seems to be grand theft auto and hitting bad man with said auto it shouldnt be so hard to find a way to make her power cool or clever but it goes for the easiest and lamest route every time theres no room for humor like if she were to see something and react different for a laugh every bit of action that could have been interesting is immediately marked as not canon as her superpower actually becomes stopping anything cool from happening


the third act is one of the most ridiculous climaxes ive seen in a movie like this and it swings so far into it that it almost becomes parody but not the fun self aware kind its more like the insincere kind you get when a company is trying to pretend theyre in on the joke but it becomes clear they dont even know what a joke is but they want to make sure you drink your pepsi™ her going to peru is a massive momentum stopper not that this had much to stop but it halts what little is going on i told myself i would try not to use superlatives in this review but the dream montage that is sparked by her trip to peru is truly some of the most awful dream montage filmmaking ive ever seen the issue of her resenting her mother really comes out of nowhere and is presented and solved in the same 45 seconds and if you arent picking up on the subtle visual storytelling dont worry because dakota is standing right there to explain everything out loud

you went to the amazon to cure me

but i dont have a neuromuscular disorder

or my favorite from earlier in the movie so it pigeon didnt die

i dont want to accuse the filmmakers of anything but this movie itself thinks i am so  that i cant tell whats happening when it snaps back to reality so it has dakota say out loud often to nobody exactly whats happening or what shes thinking i actually really like dakota she seems really funny honestly and the very few sincere chuckles in this movie are due to her delivery but this writing is doing her no favors and you can tell she and everybody doesnt want to be there

back to the third act we all know how these climaxes go and this movie blunders through the motions throughout the movie the characters learn things that will be used in the final act such as that incredibly awkward scene where dakota teaches the girls to  resuscitate and we have to watch all three of them try in a long scene that im pretty sure is just fetish content the final power dakota learns from a peruvian native dressed like fred from scooby doo is used when the stakes are as low as possible the three girls need help getting up at the same time and negated by a single punch and never used again even when this movie sets something up the payoff barely limps to the finish line with an unenthusiastic there are you happy

ive spent too much time on this already but theres still like five things that are the stupidest thing ive seen in theaters in a long time

 the villain shows up in dakotas dreams or whatever and volunteers his entire plan and motives to her when she had no clue of either

 dakota doesnt recognize the villain right away even though hes prominently in one of seemingly only two photographs she has of her mother

 las aranas is just spanish for the spiders

 dakota gets the idea that all of this is related to her mother because sydney sweeney says he crawled like a spider then she leaves three teenagers she just kidnapped in a forest with no transportation and says ill be back in a few hours

 they never explain why cassies true nemesis is a pepsi can she in multiple scenes just cannot seem to open its not a physical limitation she constantly almost opens the soda and decides not to truly cerebral acting

 she steals a taxi cab early in the movie and drives it for the entire movie even as it collects obvious damage she smartly avoids the fuzz by prying off the license plates because that doesnt stick out as obviously illegal

 at the end of the movie the girls show up with chinese takeout and dakota says kung pao chicken sounds great and sydney sweeney says how did you know how does she know did you not watch the movie

any points this movie does receive is because the only time i felt like anyone was leaning into how  and fun this should have been was at the end when dakota was in a wheelchair wearing those insane sunglasses that blocked out her dead eyes i could tell she was cracking up under there bless her heart

anyways this will undoubtedly be my lowest reviewed movie this year it ended two hours ago and i truly cannot stop thinking about how it fumbled every moment and tone and barely crawled to the credits almost impressive to make a movie this oblivious and unaware when this type of movie has been the most produced and popular type of mainstream film for the last 15 years 210

rreviewsbyboner",2024-02-15
how many people died so web could saves these 3 insuferable girls,2024-02-15
i think i’m a good 10 dumber after watching that,2024-02-15
those cpr compressions are atrocious,2024-02-15
how did melanie and don produce a child so bland,2024-02-15
“did you say webb”,2024-02-15
she falls into 3 different bodies of water  is dry as soon as she gets pulled out that bothered me for some reason,2024-02-15
"my friend is an editor on the film  was also on the team for morbius  happy for them that they’re working in hollywood  but i’ve let them know it’s a  film

their response was that it’s usually a large team that does bits and pieces  with very little cooperation and communication between the individuals  same as how game design works these days

maybe that’s a part of the reason we have so many duds in the cinema  who knows",2024-02-15
dakota is definitely winning a razzie award for this movie,2024-02-15
shoutout to the trucker at the diner getting his hands on a newspaper that had news of stuff that happened like 2 hours previously,2024-02-17
"wow i didnt actually think it would be as bad as the reviews i dont think there was a single line that was said with confidence the entire movie the bad guys lines all seemed to be dubbed pepsi really laid on the advertising heavy and who decided to cover sydney sweeney up and make her the  girl 

3100",2024-02-15
"thank  sydney sweeney and isabella merced have other big projects lined up because this movie is a career killer i can’t imagine anyone hiring matt samanza or burk sharpless to write any major movie ever again or director sj clarkson for that matter 

dakota johnson is done as a mainstream actress between fifty shades and this i can’t see any major studio wanting to hire her she might have to build herself back up with indies for a decade like robert pattinson did after twilight

also they might have to completely clean house at sony starting from the top because how a major studio released a movie this poor is very questionable what a setback for female led and directed studio movies easily the worst movie of the year so far",2024-02-15
did the villain redub his voice it didnt seem to match in almost any scene,2024-02-15
"a lot of my criticisms have already been stated more eloquently by others 

theres something deeply wrong about the girls tabledancing in a diner for a group of teenage boys after being kidnapped and stranded in the woods by a sociallyawkward adult stranger 

i dont get how they were so chill and obliging about the woods and later the motel i couldnt even focus because i was thinking about true crime statistics",2024-02-15
"is it weird i spent most of the movies run time wondering how baby cassandra went from the jungles of peru to new york city as a baby did one of the las aranas leave her at a fire station in america

also how did our big bad have everything hacked and monitored but not get a ping when casssandra used her passport

edit im just realizing a character who can see the future ended the movie blind and is named cassandra somebody thought they were clever",2024-02-17
"literally one of the worst superhero movies i have ever seen

from the advertisements i expected this movie to be bad but i didnt expect it to be this bad everything about the direction writing characters technical aspects and designs are really awful the writing is super poor as there are many concepts ideas and aspects that are messy dumb and poorly made the messy script creates poor dialogue from the cast and the characters are not interesting the special effects looked even worse than the marketing and all of the performances were pretty bad i honestly do feel bad for dakota johnson cause she is a good actress but she deserves to have better roles then this it can be said for the same for the rest of the cast members

the uses of product placements are annoying action moments are dull and and all in all it was super boring superhero movies shouldnt be boring but this really dragged on there really isnt anything else to say

110",2024-02-15
i thought it was hilarious that the villain was killed by a pepsi sign,2024-02-15
out of everything you want to know my major complaint does she not know how to hold or open a can of soda,2024-02-15
the mcu is like a professional marathon runner that had a great run for quite a long time but towards the end started losing steam and fell way behind the dceu really wanted to be a professional marathon runner but tripped 20 yards in and eventually died lying in a pool of their own  after trying to get back up multiple times meanwhile the sony marvel universe is off doing their own thing trying to turn the corpse of their pet hamster into a marathon running cyborg it’s never going to work but they’ve been pursuing it for far too long to give up,2024-02-15
"im just convinced that they are doing money laundering

because there is no way a movie with 80m budget can be this lazy written",2024-02-15
“i pay you a lot of money to use this tech   it better” lol or something like that  was supposed to sound threatening  i,2024-02-15
