comment,date
"this movie is truly baffling and pretty hilarious i think theres enough so bad its good moments to warrant a watch if you are into bad movies some random thoughts about the film 

the opening scene in peru was so off the conversation between cassies mom and ezekiel was awkward and terrible and so expositional then we continue to follow ezekiel instead of the mom anyone feel like it wouldve been better to see the mom actually find the spider instead of just marching into camp comically yelling i found the spider when we see ezekiel taking photos of the notes we realize hes evil and theres no surprise when he kills everyone except the person actually holding the spider for some reason 

ezekiel in general was just so terrible and funny he legit sounds like tommy wiseau and all of his lines are horribly dubbed over they dont match his mouth at all and a lot of shots simply just dont show his face what the heck happened there we also dont learn anything at all about this character like why did he want the spider what did he do with it he is obviously rich or something but like what does he do all day also did the spider give him antiaging powers 

i love how accurate ezekiel was able to recreate the teens faces like did he hire a sketch artist hahaha 

what exactly about cassies near death experience unlocked her future telling powers its never really explained 

also was ezekiel barefoot 

also the scene of ezekiel dumping exposition to his hook up was hilarious and so awkward did that lady bring her nsa work badge to  evil spider man 

the uncle benpeter parker baby shower stuff is so weird and shoe horned in like did they think that people would be hype for that 

i feel like i missed something why did cassie get on that train and why did the non sydney sweeney teens get on the train 

the plotting after the train sequence is just insane cassie is accused of kidnapping the teens for some reason then drives them to the woods  and abandons them for 3 hours she then drives back to the city and reads out loud to a cat her moms notes about spider people in peru like she has clearly read through some of her moms books before but was she aware of the spider people angle to her research meanwhile in the woods the girls have gotten hangry and decide to go to a local diner and leave a fire burning in the forest did they really need to light a fire at the diner they are spotted by a local trucker who recognizes them as the kidnapping victims from the paper but like didnt this kidnapping happen a few hours ago how is it in the paper anyways this leads to ezekiel driving to the diner to  them 

cassie returns to the pitch black woods to find the girls gone she walks to the diner sees the girls dancing on a table for some reason and they are then all murdered by ezekiel but sike it was a vision cassie had in the woods cassie then hops in the cab that she stole and drives to the diner which somehow takes way longer than wandering aimlessly through the dark wilderness they end up escaping and go to a motel 

cassie then goes back to the diner and has a trippy exposition dump with ezekiel it is a dream or vision or something i dont really know she then teaches the girl cpr did the producer have a cpr fetish before going off to peru to do further spider investigating 

in peru she begins back packing alone through the rain forrest and pretty easily finds the spot her mother died there she meets the spider person who birthed her in a cave pool i guess he was just waiting for her on the off chance she came idk why hes wearing regular clothes now but he is he serves as a mentor to cassie and pushes her into a pool to have a vision in the vision cassie learns her mother actually didnt hate her idk why she thought this but was actually trying to save cassie from myasthenia gravis i am in the medical field and i have never heard of an infant being diagnosed with this prenatally 

peter parkers moms water breaks and uncle ben and the girls all hop in the car to the hospital uncle ben seems a bit flustered by the situation despite being an experienced emt its not exactly clear why the girls have to come along to the hospital but they do and are instantly spotted by ezekiels surveillance system which is straight out of the dark knight 

we then have our climax at a fireworks warehouse that has a pepsi logo on the roof cassie uses her future powers to tell the girls when to duck and ezekiel is defeated by the pepsi sign anyone else craving a pepsi 

cassie is blinded and paralyzed at the end of the film is this from her powers or from almost drowning anyways her glasses and wheel chair are absolutely hilarious 

im also confused how all three of these teenagers are going to obtain spider girl powers are they going to intentionally get bitten by the spider cuz like how could all three of these friends accidentally get spider powers",2024-02-16
"this movie confirmed i have bad taste in movies because i actually liked it

yes it has cringe dialogue yes the acting from johnson and sweeney was bad yes the plot really was stretched too long in what really should’ve been the first act of an actual movie 

at the least it was better than morbius to me madame web actually has an ending morbius just ends with no wrap up at all",2024-02-16
"an absolute disaster beginning to end so baffling throughout nothing about this movie worked 210 would recommend about to watch it for a second time in the same day

edit it was so bad i actually ended up seeing it back to back 3 times what an incredible disasterpiece",2024-02-18
they slandered new jersey 110,2024-02-18
i’ve watched madame web four times and during that time i’ve also watched catwoman elektra wild at heart and the directors cut of daredevil and honestly madame web is such a catastrophe from an entertainment standpoint it just beats all of the other films thinking about watching it for the fifth time,2024-02-18
"prey didnt get a theater release but this  did

 this timeline",2024-02-20
"i just want to know how she got that great apartment in the end

barbie is citizen kane compared to this seriously this is not misogyny this is one of the worst movies possiblebut not so bad as to be good

all the women were hot adam scott still looks great 

its funny sydney is now more famous than dakota",2024-02-20
is it bad that i kinda liked the movie i was told it was worse than the marvels but to be fully honest as someone who isnt online often and doesnt go to the cinema much i liked the movie some scenes were super cringe but easily overlooked the villain  but the rest of the movie was enjoyable enough for me to forget the guy even existed honestly judging by the rest of these comments im going to get hated on,2024-02-20
guys this is the first movie i have ever seen where i left halfway through,2024-02-20
"very subpar for a marvel superhero movie and pretty much exactly whats been said by most of the critics though i disagree on it being worse than morbius but somewhat in its league for sure  mishandled and undercooked and only worthy of interest due to the choice of casting however its a pretty endearing trainwreck in being a capsule of a bygone era what with the explicit 00s superhero vibe of catwoman meets final destination and the terminator and much of the leading cast led by the oddly charming  dakota johnson and her young stooges isabela merced sydney sweeney and celeste o connor are so much more bearable than jared leto letoing his way through morbius not to mention the geely adam scott as young uncle ben 

honestly i always thought johnson to be very dull and kind of devoid of charisma in every work shes in but shes actually pretty cool here and reliable in the role of a awkward reluctant mother type even when her line delivery can come off as rough and stilted  albeit the extremely crappy dialogue are mostly to blame for it her costard dont fare any better but only one for the worse where the trio of sweeney merced and connor couldve been great under a better script but as it stands sweeney is simply a distractingly hot nerd merced a blank latina teen canvas and connor a feisty rebellious teen 

in terms of the concept and premise i really like the more grounded horrorthriller based catandmouse approach where the girls are barely trying to survive in the onslaught of ezekiel sims whos basically an evil spiderman in this that i wished the film would concentrate more on the horrorthriller thing sims first appearance in suit with him crawling atop a subway station is unexpectedly creepy than the mystical superheroic shenanigans the finale ends up being however the script is just bad bad bad on all levels and failing to meet the minimum requirements of the plot and overall narrative characters arent properly introduced and established ties to spiderman are muddled when taking into account the reworked origin of web and the spiderwomen and ben and mays inclusion to the story leading to a confused lore bad guy sims bearing little characterization and poses lots of questions that arent answered at the end and all the teases for future films which we will never get 

for whats worth its some interesting ideas like madame webb starting out as an awkward paramedic her bff relationship with uncle ben the future trio of spiderwomen establishing their own maternal bond with webb mystical peruvian spidermen while others are pretty overtly bad such as sims overall character being reduced into being a evil businessman with spidey powers and the fact that the teased spiderwomen dont actually become spiderwomen by the end likewise none of these ideas are written and presented to their most appropriate potential not even anywhere near close into contributing a workable narrative the writers have not a clue besides straying away from the source material and doing nothing with it how to handle any and every character nor the main event that transpire and relegate everything to a surface level story that makes little sense the more you think about it 

the dialogue is entirely abysmal probably one of the worst in a superhero movie ever and provides neither actor with anything to work with along with the 90 of horrendous adr by tahar rahim as sims contributing to the plastic feel of whats supposed to be a cool supervillain 

in regard to the direction by sj clarkson who brings forward little bits of neat visual flourishes throughout with the dynamic camera movements but her inexperience in directing her first feature film really stands out the majority of the time insufficiently and abruptly structured poorly edited bland and unexciting action madeforstreaming visual outlook etc its hilarious how identical all of the films of the sony spiderman venom universe is that the underwhelming handling is becoming a sort of a template nowadays lets be honest kraven will be more of the same as well truthfully despite all of its negatives the movie itself being set in 2003 and actually feel like an early 00s stylized superhero movie in the vein of daredevil electra and catwoman and as a nostalgic fan of said films i find madame web to be just as dumb and entertaining enough to not be overly boring or offputting like morbius",2024-02-15
"ive been among those that made fun of everything going on during the last few months regarding this movie and was absolutely convinced that it would end up as the kind of bad that is by the numbers generic uninspired soul and heartless when the reviews came out my impression shifted to unintentionally hilarious trash that fell short in the ambition of becoming at least a somewhat tolerable superhero flick in an exceptionally long line of marvelsonydc garbage i decided to watch it for a laugh and  im gonna get downvoted a ton  found it incredibly charming in its goofyness appreciated its suspensethrillerangle seriously thought that those responsible for the movie at least put some heart into it and tried to do something to distinguish themselves from the canon dakota johnson and sydney sweeney were lovely in it while all of the girls character evolutions and their relationships with each other were nicely uplifting

this is not to say that madame web is a good movie  it is bad but bad in the right ways as clichéd as that sounds its gonna gain a cult following and become for the superherogenre what i know who killed me became for psychothrillers

edit what i also appreciated was that they went with a female cast but did not make the mistake of going that  route that led to the strangulation of so many other projects of the last years",2024-02-16
"dakota johnson felt pretty proud for not knowing anything about the previous spiderman movies like that was beneath her and now it appears she fired her agent for getting her into this movie serves her right i guess

these nepobabies cant be bothered to put in the littlest bit of effort in their work",2024-02-15
"personally i enjoyed the movie i get theres a lot of hate on it because of lacking villain reasoning but truly i think originally the man just wanted power to build wealth the moment he stole it he saw his death every night and was then just focused on stopping it thats all there is no big plot or anything just a small villain who couldnt leave anything alone 

as for the somewhat emotionless madame web i mean as far as i know for comics thats how she is shes not this big web swinging hero shes the one who sets up the future for others she is blunt and straightforward and i actually like that about her character im glad this wasnt just another web swinging movie",2024-02-17
"just got back from seeing this and honestly it wasnt as bad as the internet has made out to be dont get me wrong  it isnt great and its nowhere near as slick as the disney mcu movies but there were some interesting ideas in this film

first of all its not really a superhero movie its more of a slow burn psychological thriller the sequence on the train at grand central terminal was actually pretty gripping and wellexecuted

dakota johnson does a good job with the material shes given especially in the scenes where shes on her own and reacting to gaining her superpowers

the early 2000s vibe is captured pretty well and it even feels like it was made in that era the atmosphere is much more unbreakable than avengers if m night shyamalan had directed a spiderman film in the mid aughts it might have looked a little bit like this

now on to the negatives  both the peruvian sequences were leaden with cliché dialogue and plot holes how did she leave the country and get back in again as the chief suspect in a kidnapping i rolled my eyes so hard at the scene where cassie met her mother

the villain was forgettable and poorly acted his lines were so obviously dubbed it made me wonder if they were originally meant to be spoken in spanish his character is peruvian and the producers changed their minds at the last minute

sydney sweeney was surprisingly not good casting her as a shy selfconscious teenager was a mistake it just wasnt convincing her outfit too  it just didnt fit with the character they were trying to portray the other two actors playing the teen characters were okay ive never seen sweeney in anything else and im sure shes a decent actress but this role just didnt fit",2024-02-18
"its certainly not going to win any awards but it wasnt that bad

youd think it kicked peoples dogs by the way theyre offended by how bad it is

the villain tho  oof i dont think his lip movement matched like any of this words

but is there any explanation at all as to the psychic dream thing ignoring that its the villain monologuing his entire plan or whatever but neither the villain or lady web were shown to have any psychic powers or anything",2024-02-18
it wasnt that bad compared to what the internet made it sound like i feel like the marvels was honestly worse i really wish there was more screen time of the spidergirls in their suits,2024-02-18
havent seen the movie yet but is it explained why emma roberts is supposedly peter parkers mom yet adam scott is playing uncle ben like  is it implied ben got with richard his brothers wife or how the  is ben peters uncle or is he the brother to emma roberts mary,2024-02-15
madame webb will be a camp classic  will eat it up,2024-02-17
i went with me and my wife’s family and we all liked it the girls had great chemistry however we thought it was weird that she couldn’t walk at the end of it,2024-02-17
i know the writing was pretty bad at times lol and the  wheelchair at the end took me tf out  but i didn’t hate watching this movie would definitely catch on cable in the future,2024-02-18
are there any good  moments sydney sweeney is stacked,2024-02-15
"i mean no one needs to be defending this movie and this is going to be very small praise but i understood what was happening in it and the pacing was solid and the motivations all made sense in that regard i dont know where all this worst superhero movie ever stuff is coming from  can anyone look me in the eye and say this was worse than quantumania 

im not saying this is a good movie or a decent movie or that it doesnt have the most hilariously bad acting or dialogue ive ever seen im just saying  its more watchable than quantumania or the marvels or especially morbius",2024-02-20
i guess im crazy because i enjoyed it unironically in spite of its many problems yes there is some bad acting there is some clunky writing there is some very bizarre cinematography there are plot holes and things that dont quite make sense and the final battle is a complete mess and still i liked it genuinely and am very sad that a sequel is never going to happen now,2024-02-22
just like my neighbor and landlord  the critics and the general public learn how to enjoy things not every comic movie can be endgame learn how to enjoy things the way they are presented,2024-02-21
its really interesting to see how quickly people can agree on a movie being bad when disney bots arent crawling all over the web calling critics ists and phobes guaranteed the articles would be everywhere about how chuds just cant handle a movie directed by and starring powerful women,2024-02-17
nalgas,2024-02-15
im not being hyperbolic when i say that this is probably be the worst movie i have ever see in my life and i dont think thatll change any time soon,2024-02-15
i’m not going to see this in theaters but i am kind of curious from anyone who’s seen it what are the postcredit scenes,2024-02-15
why are you guys so surprised it’s not the first rotten sony superhero hero movie ,2024-02-15
why do so many people go see these obviously bad movies ,2024-02-15
"this movie was even worse than the critics made it seem and its so cringy i mean the best part is that dakota johnson is visibly doing this for a paycheck and she looks miserable saying the godawful lines in the script at one point she rolls her eyes at how bad the dialogue is 

also what the  is going on some mass murderer is looking for dakota and my girls and she has time to go to south america for a week and how did zosia mamet get herself in this she looks like mary lynn rajskub 

its campy but also dull a two hour movie with barely no action dakota johnson is funny with her deadpan monotone delivery and sydney sweeney isabela merced and celeste o connor try their best to be convincing as the vapid unlikable victims with their cw teen lore dialogue 

tahar rahim is so bad in this movie that i even wondered if they used tahar rahims identical twin brother who cant act",2024-02-15
once this hits streaming  im going to watch this on like a saturday afternoon while laying on my bed hungover and doomscrolling through reddit and waiting on my doordash to arrive,2024-02-15
"im very surprised the director or anyone on the crew didnt want their name wiped from this was there no test screenings why would you make incredible bulk 2 blue screen boogaloo how do you become blind and binded to a wheelchair after drowning 

make it make sense please",2024-02-16
"the villain guy sounded like a  robot or something


sydney sweeney is terrible in this seen her in a handful of diff projects still not convinced shes an actual actress 
everything sucks the writing directing camera work acting 
going to  perú and back ",2024-02-16
went  and still had no fun,2024-02-16
the voice for the villain was adr’d throughout the whole movie the plot was horrible and the camera kept moving in such an awful way at the beginning with the zooming in and out the main character was always in deep thought which was very boringi watched it for my sisters birthday but she just got up after the first scene and left i hope her birthday party goes well on saturday to celebrate with her friends… my mother somehow enjoyed it does this movie remind anyone about the incredible hulk movie in like the early 2000’s with the weird comic  movements or is it just me,2024-02-16
i have a lot of superhero tshirts and im a nerd so when i go and see a superhero movie i usually wear the tshirt of the  the movie i didnt have a madame web tshirt so i didnt bother this time and just wore a pepsi tshirt instead so the fate of the villain made me laugh quite a lot,2024-02-18
"comically bad but i expected that and i think because of that i enjoyed it

was more enjoyable to me than zone of interest and thats up for best picture 

not saying its better but definitely more enjoyable",2024-02-18
just got back from seeing it and i can not for the life of me remember the scene of madame web talking about mary parker dying and ben having to raise the baby when did this happen,2024-02-19
somebody please explain to me how claire parker a person who died 43 years ago is a writer for this movie,2024-02-19
"this one was rough to get through my eyelids were actually getting heavier and heavier as the movie progressed none of the main cast had any chemistry with each other at all performances were lackluster especially dakota johnson but dont really blame her and these three other girls that she is protecting did not buy that they were teenagers at allik their age irl but its still painfully obvious they are adults in this movie

these three kids dont even do anything even close to superherolike for the whole movie excluding like 30 seconds of them fighting crime in their suits in visions of the future thats it they are just teens in danger for the entire movie no character development that properly leads to becoming these badass spider girls the villain was also very boring his entire character is he is trying to  these girls before they become superheros and  him thats it thats his entire character plus his postproduction dubbing or whatever its called sucks

this movie is just friggin boring the action in this is not even action just repetitive sequences of madame web seeing the future like in thats so raven and immediately yells to a character to watch out and thats all it is aside from when web hits the boring evil spider dude with an ambulance to save the teens and ben parker the only time theres anything really actiony is in the climax battle but i still didnt care and how web goes blindits basically just ouch and she has no other reaction to it she just lost her eyesight forever andhas no realistic reaction to it 

my only real positive i can give here is adam scott is pretty solid in this movie gives a far better and more charismatic performance than this movie clearly deserves",2024-02-20
what was the reason for the movie being set in 2003 is there something its trying to set up for the present day,2024-02-20
"i just saw the movie

the absolute best thing about it was the diner scene when the guy with the poison powers showed up and they were playing toxic by britney spears get it toxic because hes a spider and he has poison powers and the song is called toxic hes a spider the song is toxic do you understand the reference

i honestly lost it when i noticed that this is like shrek 3 levels of hilarious quick we need a song for the kings death scene  lets use live and let die by guns n roses because it has die in it  perfect next scene in hindsight im honestly amazed they had the restraint to not go all out with alice coopers poison

this movie was gold easily 1110",2024-02-26
watched it last night its not as bad as the reviews made it out to be although between the soso acting bad writing and frayed third act theres much to be desired,2024-02-16
i loved it ,2024-02-15
"its not good but its also not so horrible that you want to walk out

but its probably not worth the ticket price maybe wait and watch it on streaming",2024-02-16
shes driving around the most identifiable car ever the fact that she hasnt ditched it already is absolutely ridiculous especially after crashing it into a diner,2024-03-16
"i’m still confused why the villain never went out and bought some guns  

 dude you’re significantly more athletic and faster in speed and reflexes than all four of them just jump in and shoot them   

also why were they in the car at all to drive ben’s sister to the hospital leave them at your house jesus did ben forget he was a paramedic and that babies don’t instantly pop out when water breaks ",2024-03-16
half way through this moviesouth american spiderman is the terminator madame webb is kyle reese the three girls are sarah connor,2024-03-16
multiple highly paid people saw the final cut of this film and decided it was good enough to put out to theaters seriously,2024-03-16
is it just me or is the villain already in the diner like i see a shaved tahar rahim sitting next to the 3 girls at the bar its clearly him i first thought it might be timey wimey thing  but it was not picked up,2024-03-16
