comment,date
" and who decided to cover sydney sweeney up and make her the  girl

it isnt even a weird reddit hornybonk moment here  it is  hollywood  how do you have the hottest woman on the planet right now figuratively and literally and you dont have her show any sort of  appeal at all and then blue ball us with no spidersuit for any of them


how do you not include two basic things in your movie the two things that people are actually looking forward to whether you like it or not


absolutely mindboggling",2024-02-16
nah bro dakota just got announced to star in a film directed by celine song with pedro pascal and chris evans haha,2024-02-15
i dont think pattinson needed to build himself back up he was getting around 40 million for each twilight movie he is genuinely a weird as  creative dude who picked the projects he wanted because he had his twilight paycheck like a wholesome lebouf,2024-02-16
if you told me sydney sweeney could act and all i saw was this movie i would call you a liar,2024-03-08
good for isabela and sydney because they deserved better than this i think a serious role in the last of us suits isabela i also hope that hawk girl works out because she isn’t getting any more work at marvel and a serious role in like three thrillers apparently suit sydney,2024-02-19
i think dakota johnson will be fine by continuing working on projects similar to what she had been doing prior to madame web plus shes a nepolegacy baby  but not going to lie those writers and director only did stinkers really wondering who would even hire those three in any future big projects,2024-03-18
theres nine years between fs and this movie for the record,2024-02-19
seems like the original plot was way different than the one we got probably lots of script alterations and reshoots so they needed to adr his voice since he had the most lines and they had to make sense of it,2024-02-15
or the fact no one in the diner told them to get the  down and knock that  off,2024-03-17
plus sydney sweeneys character was supposed to be the shy one and now she is dancing on a table in a miniskirt giving a bunch of dudes an upskirt view,2024-04-07
nope because i was wondering why she didnt grow up in peru,2024-02-17
" im just realizing a character who can see the future ended the movie blind and is named cassandra somebody thought they were clever  

the character cassandra webb was created in 1980 i know youre referring to the mythological character",2024-02-17
thought the same thing and she even kept her moms name,2024-02-25
"superhero movies shouldnt be boring but this really dragged on

oh no i want this to be laughably bad not boringly bad",2024-02-15
"i don’t understand the product placements

how on earth does someone at pepsi decide that they want to be associated for this by paying money",2024-02-15
dakota is a good actress girl im sorry but no,2024-02-15
so the flash was better than this ,2024-02-15
"the sony exec so what do you guys think pepsi paid a lot of money for a prime advertising spit and we really wanted to make it worth your while d

pepsi execs dear 

sony exec no backsies",2024-02-15
i was like he survived being run over by an ambulance and a taxi literally unscratched surely this will not do any oh hes dead,2024-03-04
"im convinced that those were prop cans of soda and she was under explicit orders to make them part of the scene but not to open them  nothing else makes sense

the best part of the product placement is that pepsi kills somebody",2024-02-15
hey she had to make sure the logo was facing the camera,2024-02-15
did it look like this guy trying to open a milk box ,2024-02-15
explain,2024-02-15
"just for accuracy in this analogy the mcu capped off a goat ten year run and really stuck the landing of their true ending like winning the olympics 3 straight times

its what came after that has been middlingsucked 



also wanna add that they were the cinderalla story for a while there as they started out a longshot broke af rookie who bet everything on themselves on their last chance then hit so many impossible wins that the yankees bought them then going  nuclear for such a long time that its  off every single movie snob on the planet i enjoy mixing analogies",2024-02-15
it is just amazing how many bad super hero movies sony has made,2024-02-15
i can understand that venom was successful but morbius failed madame web will fail kraven will possibly fail will they really continue this franchise sounds kinda  from every perspective,2024-02-16
 id say the dc universe managed to actually get up two or three times and run a couple of miles but then immediately tripped and fell again for good,2024-02-17
thanks for explaining it in a way my simple mind can understand,2024-02-15
i rarely save comments that arent cute animal gifs but this was one of the funniest things ive read in a while,2024-02-15
this ain’t even in the mcu,2024-02-19
what does he even do why is he so rich,2024-02-15
 “use it better”,2024-02-15
she’s a nepo baby so there’s that i do think she has talent but she has terrible taste is projects,2024-02-16
shes great in cha cha real smooth and the peanut butter falcon,2024-02-20
i want a madame webb hitb so much more than the batman review i’m praying to rich evans that they make a video,2024-02-15
"remember spiderman 


it broke new grooooound",2024-02-15
"i feel like since they brought back the nerd crew and havent done a hitb in a while i can see them doing it but with a slight commentary on the sony movies and how they seemingly duped some people in it or something



theres so much wrong production and editing wise i can see jay having a field day with this",2024-02-15
remember to take away the super heroes too lol,2024-02-16
they literally hired the same writers from morbius for this lol,2024-02-19
i had low expectations but holy ,2024-02-15
i am just playing a cam record version in background while reading these,2024-02-16
interesting thought a lot like the tv series birds of prey from the same era in which the movie is set now that you mention it,2024-02-15
i’d be a little intimidated if i saw someone walking barefoot on an nyc subway,2024-03-16
yeah it seems they think paramedics just do cpr,2024-02-16
poor sydney looked like they had her in a chest binder,2024-02-20
how did they even have the girls pictures,2024-02-19
the power of the press triumphs,2024-02-20
did you just say morbidly curious,2024-02-15
i think sony just wants to do this themselves i dont think they should but its sort of cute like when my 7 and 5 year old nephews want to stir the cookie dough or shovel,2024-02-15
also her powers stopped telling the future accurately too she already saw the future with her plan working and them escaping on the helicopter then instead the burnt down firework factory burnt down a second time and fired a homing stinger firework missile at the helicopter i guess the evilspiderman slapped her  with his poisons beyond time lines and rewrote the future,2024-02-16
i mean i think that was just her planning based on what she saw like that nick cage movie,2024-02-16
interestingly enough catwoman 2004 was 20 years ago,2024-02-15
which is annoying because you never see a bad male superhero film and hear people say it’s setting back male superhero films,2024-02-15
 and then she road raged over to the diner and wrecklesly cuts off a  logging truck only for her to immediately make a right turn like girl just  wait lol,2024-02-19
her finding a random spot in the jungle from one photo and the bad guy somehow getting 3 jpegs from his psychic vision were hilarious,2024-02-18
"it’s not just that she found it she flew to a foreign country with no hint that she can speakunderstand spanish

finds the mysterious spot within minutes along with the mysterious spider people who by the way also speak english",2024-02-19
i’m sure they had shots of her searching and being led by her web of intuition and spider sense… but they didn’t show that to us did they lol,2024-02-20
i could very clearly hear the exact points in the movie that will become dings,2024-02-20
a company that wants to keep the rights to make spiderman movies,2024-02-15
give me the spider,2024-02-16
i kept waiting for her to get busted for the cab but she popped off the plates and that was that,2024-02-16
is the city still looking for those 3 girls at the end of the movie one truck driver found them so i can imagine everyone in nyc can recognize the 3 of them did they talk to the police saying theyre fine did they explain what there story was being with webb and the exploding fireworks warehouse  wouldnt nypd question these for women about the the guy in the black suit and what caused multiple cops earlier to get killed or injured,2024-02-16
you did it you did it hug,2024-02-24
dont worry she would later become a nun in a creepy convent,2024-02-15
yeah that stuck with me too why was this even mentioned if it wasn’t going to be used as a call back later,2024-02-18
yeah my whole theater laughed through the whole thing,2024-02-15
"it’s the cats of superhero movies

okay catwoman was probably the cats of superhero movies but this is at least the dear evan hansen of superhero movies",2024-02-15
none of the scripted jokes landed but i was laughing almost the whole time even the moments that were meant to be serious or emotional got some funny reactions and people in my theater had a blast it’s garbage but i’d say it’s definitely entertaining,2024-02-15
yes the movie was horrible i had a blast,2024-02-17
i had a lot of fun definitely entertaining,2024-02-17
no it’s just awful,2024-02-15
" is this movie crossing the line of “it’s so bad it’s good” like a bizarre cult following of making fun of it can happen here

yes its an objectively awful film but i loved watching it because its so  

its like if sonymarvel made the room",2024-02-17
i found it to be a campy masterpiece that im suspicious of sony intentionally knowing or not but regardless my theater was having a blast,2024-02-18
no a couple of hours of nonsense after they lied to us on the trailers,2024-02-17
no it’s just bad no good,2024-02-18
dude his voice ruined it for me he sounded like an unintimidating kermit the frog,2024-02-16
"that wasn’t even a psp it was a vita i think i read

also ",2024-02-16
the next shot is of the ambulance in perfect shape the following time they show it the front has some ridiculous grill and front damage that looks glued on clearly film making professionals at work,2024-03-05
corazón lol tbf the dj said the song would be huge,2024-02-16
how is she able to leave the country while a wanted fugitive,2024-02-17
"the taxi cab thing was hilarious

my wife and i were talking about the second point wondering how she got out of the country i blocked out parts of the movie but was she ever technically wanted i just remember a radio comment about police being interested in a 30 yard old woman as a person of interest i don’t remember her name being said",2024-02-19
"why didnt ezekial make a deal to share the spider


they dont explain if he got bit or just used its venom doesnt he have it at his apartment just give her some venom or let it bite you and give the spider to her


or if she found it in that spot why doesnt he go to that same spot later and not  everyone


apparently its not a unique spider like the radioactive one that bit peter",2024-02-16
judah wouldnt let her near it,2024-02-15
it was  but i had fun ,2024-02-19
the adr was stunning i felt like i was watching a spaghetti western or a 70s kung fu movie,2024-02-20
"i dont know how its camp its boring as  and has zero themes no personality


its just  duct tape together",2024-02-15
" and where is richard his wife is pregnant and i see her with her brotherinlaw more than her husband

i think they were implying he has some kind of secret job eg shield",2024-02-17
what bothered me was when the girls saw the picture of madam webs mom and ezekiel they immediately noted thats the guy thats been following us despite the fact he was in costume on both the train and the diner,2024-02-17
how did she still have the same stolen beat up license plate free cab after getting back from peru did she park this at the airport for a week and how did no one notice,2024-02-17
this is time travel 101 character causes the very thing they were trying to prevent  seems likely they were only after him because he went after them first,2024-02-17
i dont think he had visions about future he had bad dreams about these girls but his future was always meant to die by cassies hands so he was wrong,2024-02-17
hes enough of an  that i presume his wealth is the fruits of a massive powered crime spree so maybe he was slated for a spot of vigilantilism or the vision might simply have been the totemspirit of spiders  with him no way to really tell,2024-02-18
i love how he never considered that they  him because hes dedicated his life to killing them first dude really needed to read a copy of oedipus rex would have saved him a lot of trouble,2024-02-24
id say its somewhere between that since it kinda jumps back and forth but leaning more into hilariously bad its a remarkable movie in how  to  it actually is the idea and plot of the movie isnt bad per se but the execution and how it unfolds is unbelievably  i actually want people to see it to believe it,2024-02-15
its kinda just bad i wouldnt spend any money on it,2024-02-25
"hilariously bad 

if you think sydney sweeney is hot and u like to laugh it’s worth seeing once",2024-02-27
i was amazed to realise he was in napoleon where he was really decent and sorry to say but his voice in this was really distracting with how nonintimidating he was,2024-02-15
no you’re right but the movie was almost over so they were hoping you forgot that,2024-02-16
of all the terrible things in this movie that is what stands out to you,2024-02-18
" how many others noticed they started a fire in the woods and left without putting it out

if three frightened and hungry teenagers from the city left a small fire burns in the wood is your most glaring error in this movie i would say its pretty fine",2024-02-18
she seemed internally smug at knowing that peter parker’s parents were going to die and uncle ben was going to have to raise him ,2024-02-20
how can you have an opinion on something you havent even seen ,2024-02-22
that’s not her cat it’s a stray that she lets in and sometimes feeds she said that to the cat “we’re both strays”,2024-02-21
i had a cat named cat once before she vanished into the twilight of halloween,2024-02-20
" man eternals really wasn’t that bad just slow and boring in many spots

this movie makes the spirit the phantom catwoman and jonah hex look like the criterion collection",2024-02-15
"no 

they would have been better off with a morbius 2 tease",2024-02-15
nope lol,2024-02-15
so she’d watch a christmas carol in july,2024-02-18
it was so poorly adr’d and extremely off putting,2024-02-18
coyote vs acme could literally be the greatest film ever made and it still wouldnt be released no decision made in hollywood today is about quality not one,2024-02-20
she’s socially inept to the point where i’m actually kind of mad at ben for bringing her to the shower just so she could act like a ,2024-02-20
hahaha nope get ready for their next movie everybody’s favorite spiderman villain rhino coming summer 2025,2024-02-15
i guess its because she got her powers through her mum getting bitten before she was born so maybe theyre watered down somewhat but even in the comics i dont think she has the physical powers or the healing factor as shes blindparalysed in them as well,2024-02-15
she got hit in the face that also paralyzed her i guess,2024-02-16
what got me is how much it looked like a  cosplay,2024-02-16
"the original comic book madame web is a 84 years old lady whos blind and cripple everyone assumes this was an origin movie and thats how they explain how she ended up in a whell chair in the comics and videogames
note there will never be a sequel to this ",2024-02-17
its neuromuscular disorderin time,2024-02-20
if they dont die there will be no spiderman need spiderman to win the secret war lol,2024-02-18
oh yeah… they ancient one her,2024-02-20
cassie’s line delivery the second time he wants confirmation he’s on the correct train is my favorite line reading in the whole film,2024-02-20
truly a masterpiece  saw it 3 times on saturday i just had so much fun suffering from how awful it was and my various friands reactions to certain line readings truly truly a new low for comic book movies so glad it exists will definitely go see it at the inevitable cult classic showings in the future,2024-02-21
i lost my  laughed hysterically  any time ezekiel spoke,2024-02-21
she’s already fired her agent so halfway there i guess,2024-02-15
" dakota johnson hasnt been in a single good film

the social network 21 jump street black mass suspiria bad times at the el royale were all films ive seen her in that id consider good films

fair enough a couple were minor roles but they meet your criteria

needs to either fire her agent

pretty sure she did ",2024-02-17
the album it appeared on was actually released in 2003,2024-02-16
yeah i agree i liked the idea worst execution possible though ,2024-02-15
"i didn’t think quantumania was a bad movie love and thunder was bad 

i hadn’t seen madame web yet but every time i looked it up the critics scores is constantly dropping lower and lower

i think a lot of people tend to jump the bandwagon on whether a movie is bad or not everyone is entitled to their own opinion but when people said quantumania was bad for example i think it was more of a bandwagon",2024-02-16
i don’t think she was wanted they didn’t have her name i thought the news just referred to a 30something woman,2024-02-16
this was the second movie after slenderman that i seriously considering walking out halfway through,2024-02-19
imagine still rating movies on imdb when letterboxd exists,2024-02-15
duo,2024-02-17
they didnt want to  carpenters the carpenters or john carpenter,2024-02-20
because,2024-02-17
" why did the girls have to go with adam scott when emma roberts went into labour

well last time they were left alone they went lap dancing in a dinner also after a full week at mary parkers place they had totally bonded with her and wanted to be there for her child birth

 also how much do new york paramedics make to afford that huge apartment in queens

moms inheritance  and yeah that thought probably went through half of the viewers when she came home that time

 only one of the teenagers looked like a teenager

thats because none of them are and its quite crazy they dared to go that way just because they wanted to cast some up and coming actresses for their surefire new franchise

 whyd she keep the banged up taxi did no one notice the banged up taxi

she removed the plates and all ny taxis are banged up after all  the driver just decided that it wasnt a job for him and didnt report it he went on to become a bike courier

im totally grasping at straws here but its funny to try to fill the many holes of this movie",2024-02-17
honestly i think night swim was better,2024-02-24
i counted at least three times that line was said,2024-02-24
all of that so they can say “like a spider”,2024-02-20
"sony has good movies


its mostly the spideyrelated movies that are ",2024-02-18
lol sony animation is allowed to connect to the mcu and columbia pictures isn’t,2024-02-20
it also bounced off of ms webbs head  sure the impact blinded her but it still rebounded  even though the water must have slowed it i didnt buy fireworks being that powerful,2024-02-20
lol how did they not all blow up the first time,2024-02-20
“im gonna convince the world i’m not a kidnapper by actually kidnapping the girls instead of letting them go”,2024-02-23
" who reported that

one of the girls screamed it out earlier i think the blonde one either way its ",2024-02-23
" the police are after her for kidnapping  who reported that

the awkward girl shouted that out for like half a second which obviously led to the officers around immediately reporting that to the worldwide police hq which then relayed that information to your average taxi radio and had articles printed in the newspaper within 3 hours

its like someone told the writers they needed the characters to get from a to z within 3 lines of text and the writers just went wild with it",2024-02-26
there wasnt definitely a lot of dubbed lines not just from him but everyone,2024-02-16
that’s accurate,2024-02-16
i noticed it as well also the leader of the spiderpeople in the first cave scene i just shrugged it off as bad adr editing,2024-02-17
"its called adr its a type of dubbing used in post production when studios change the script after the main filming was done
what i wonder is if it was really the same actor doing the voice over because it got way too weird",2024-02-17
"absolutely

but elektra was worse which says a lot about elektra",2024-02-17
this was 2003 nsa had gps but that tech wasn’t really publicly available to the masses ,2024-02-18
but yes i was also confused why she didn’t give ben the ambulance since he and preggo needed it more ,2024-02-18
except for the team who animated and edited las arañas bouncing from branch to branch,2024-02-20
huh i saw the film 3 times and each time i was like wow this is truly terrible argylle was bad but this was leagues and leagues worse imo of course,2024-02-21
a rerelease sequel would be epic,2024-02-15
 yeah looking forward to my madame web double feature tomorrow even more now,2024-02-16
hes in like 23 scenes and given nothing to do,2024-02-15
at least it has scholastic merit sony doing students a solid,2024-02-15
i wonder if someday the reasoning behind sonys decision to make this movie will be revealed,2024-02-16
streamers are just that starved for content that sony still thinks they can make money on the secondary after market is my guess,2024-02-16
im so glad they started the movie with it between her mom and ezekiel it gave me a good idea of what to expect for the rest of it,2024-02-17
"i like “so bad it’s good”
 went into this expecting dumb superhero movie this was just bad bad ",2024-02-18
because the movie needed to end,2024-02-19
thats something the character does in the comics but its never referenced in the movie at all,2024-02-20
wait  what  time for a second viewing,2024-02-20
also they don’t need to include it in every spiderman movie that’s what ben says to peter,2024-02-20
fix her spine,2024-02-20
"“when you take on the responsibility great power will come”

that’s not a joke",2024-02-20
but i dont have a neuromuscular disorder,2024-02-21
"“am i on the right train”

“get down”

“get down”",2024-02-20
i pay you a fortune,2024-02-21
her awkwardly holding onto that can at the bbq and not opening it so so frustrating lol,2024-02-20
maybe if we actually heard his voice instead of the posthoc adr rewrite we’d have some clue  he was doing,2024-03-01
great song but it came out six years before this movie is supposed to be set and wouldn’t be on the radio neither would toxic which would not have been out yet,2024-02-16
she implies she knows richard and mary are gonna die but doesn’t do anything about it,2024-02-16
its hilarious,2024-02-15
it’s morbid time,2024-02-15
in mumbai or beijing she can never remember,2024-02-15
she ate him after copulation,2024-02-16
the s is from a pepsico signage on a rooftop and is what kills the villain you heard it right,2024-02-15
bad movie little backstory for most characters exposition that comes from nowhere but also everything is foreshadowed bad guy dies from a letter from a pepsi sign but not being hit by a taxi and a falling ambulance driving through a parking structure that he also jumps into,2024-02-24
"this movie is an origin story for madam web a minor spiderman character from the comics who is telepathic blind and is wheelchair bound 

the plot is about how madame web goes from a paramedic into becoming this superhero and spends the runtime protecting three high school students that madame web sees becoming other spiderwomen in the future with spider themed powers that are on the run from a villain cursed with visions of these three girls killing him in the future  

his plans are thwarted when a pepsi sign falls on his head killing him go pepsi",2024-02-15
"hes wrong because you see them in the final shot suited up so technically hes wrong


so its what you see in the trailer and the final shot thats it",2024-02-15
yes,2024-02-15
i saw one review say it makes morbius look like the dark knight,2024-02-15
maybe get hammered and retroactively black out the day before,2024-02-16
i think she had redeemed herself by distancing from the movie she looks so forced on every scene this is the most relatable millennials come to work on monday style of acting i have ever seen,2024-02-18
it is,2024-02-19
"i think it depends what your reaction to bad is morbius is a boring dull predictable superhero movie with vampires 

this is a hot mess of unintentional memes that was an actual train wreck that we can’t look away from",2024-02-20
the britney spears song is also on the radio several months early and the dj refers to her like a new up and coming artist even though toxic is from her fourth album,2024-02-21
yeah i mean it was fine haha i was the only one in the theatre the adr on the villain was weird and it would have been nice to develop his character a bit more but whatevs  it’s not the garbage fire everyone is making it out to be,2024-02-22
it wasnt good but it was entertaining even if only ironically not nearly as bad as people are saying pretty cool concept tbh just lazily done,2024-02-23
